{
  "$schema": "./map.schema.json",
  "format": "tapfire-map",
  "version": 2,
  "id": "arena",
  "name": "Range",
  "about": "The open training range: two raised platforms with stairs, crates and walls. Deathmatch.",
  "modes": ["dm"],
  "environment": {
    "sky": "#a9c2d8",
    "fog": { "near": 90, "far": 220 },
    "sun": { "color": "#fff3e0", "intensity": 2.2, "from": [-30, 60, 20], "shadows": true },
    "ambient": { "sky": "#dbe7f3", "ground": "#5a554c", "intensity": 1.3 },
    "ground": { "mat": "floor" },
    "lights": []
  },
  "physics": { "gravity": 22, "jumpSpeed": 6.95 },
  "rules": { "deathmatch": { "respawnTime": 3, "healOnKill": true } },
  "grid": {
    "layout": [
      "####################################",
      "#PPP4321....#..........#....1234PPP#",
      "#PPP4321....#..s..s.s..#....1234PPP#",
      "#....s......#..........#......s....#",
      "#.....cc........s..s........cc.....#",
      "#..c....C..................C....c..#",
      "#........c..##........##..c........#",
      "#.hh........##........##........hh.#",
      "#....#########........#########....#",
      "#....#########..c.....#########....#",
      "#....#########...s....#########c...#",
      "#..cC#########.ww..c..#########C...#",
      "#....#########........#########....#",
      "#........c......CC....#########..hh#",
      "#......s..............#########....#",
      "#.s..#########.....hh.......s......#",
      "#....#########............c......s.#",
      "#...c#########.c......#########....#",
      "#....#########......c.#########.c..#",
      "#....#########....s...#########....#",
      "#....#########........#########....#",
      "#............C........C............#",
      "#....c........................c....#",
      "#..w.....##......##......##.....w..#",
      "#..w.....##..ww......ww..##.....w..#",
      "#.............c......c.............#",
      "#..c..............s.............c..#",
      "#.......s....s...s....s....s.......#",
      "#..................................#",
      "####################################"
    ],
    "legend": {
      "1": { "mat": "stone", "h": 0.4, "pen": false },
      "2": { "mat": "stone", "h": 0.8, "pen": false },
      "3": { "mat": "stone", "h": 1.2, "pen": false },
      "4": { "mat": "stone", "h": 1.6, "pen": false },
      "#": { "mat": "wall", "h": 5, "pen": false },
      "c": { "mat": "crate", "h": 1, "pen": true },
      "C": { "mat": "crate", "h": 2, "pen": true },
      "h": { "mat": "half", "h": 1.2, "pen": false },
      "w": { "mat": "wood", "h": 2.8, "pen": true, "thin": 0.3 },
      "P": { "mat": "stone", "h": 2, "pen": false },
      ".": {},
      "s": { "spawn": true }
    }
  },
  "labels": [{ "text": "A", "cell": [4, 4], "y": 2.02 }, { "text": "B", "cell": [31, 4], "y": 2.02 }, { "text": "MID", "cell": [18, 14], "y": 0.02 }]
}
